gene_symbol,Howard_pvalue,gene_name.x,RamakerDir,LabonteDir,DingDir,meta_meta_higher_in_MDD_pvalue,meta_meta_lower_in_MDD_pvalue,meta_direction,meta_p,minp,Corrected_p,Bonferroni_meta_p,Spearman_corr,Spearman_p,DE_Prior_Rank,gene_name.y,brain_region,region_location,slim_region_location,cns_cell_type_taxon,cell_type_taxon
MANEA,1.8836e-06,mannosidase endo-alpha,-+-+,++++----,---+-+,1.65546004437707e-06,0.037751687315786,+,3.31e-06,0.000771466,0.000891,0.000891,-0.109,0.0752,0.87,mannosidase endo-alpha,lateral group of nuclei dorsal division,lateral group of nuclei dorsal division <  lateral group of nuclei  <  dorsal thalamus  <  thalamus  <  diencephalon  < gray matter,lateral group of nuclei dorsal division <  lateral group of nuclei  < dorsal thalamus,Hindbrain neurons,Hindbrain neurons
UBE2M,8.888e-07,ubiquitin conjugating enzyme E2 M,+-+-,-+--++++,+---++,0.953061363056755,1.90191598474834e-06,-,3.8e-06,4.9052e-05,0.00102,0.00102,-0.109,0.0752,Not_Available,ubiquitin conjugating enzyme E2 M,parolfactory gyri,parolfactory gyri <  frontal lobe  <  cerebral cortex  <  telencephalon  < gray matter,parolfactory gyri < frontal lobe,Cholinergic and monoaminergic neurons,Peripheral sensory neurofilament neurons
TMEM106B,1.2176e-12,transmembrane protein 106B,-+-+,++++----,---+-+,5.79724957710377e-05,0.0105554722400232,+,0.000116,0.000216239,0.0312,0.0312,-0.109,0.0752,0.857,transmembrane protein 106B,reticular nucleus of thalamus,reticular nucleus of thalamus <  ventral thalamus  <  thalamus  <  diencephalon  < gray matter,reticular nucleus of thalamus < ventral thalamus,Cholinergic and monoaminergic neurons,Cholinergic and monoaminergic neurons
CKB,1.7557e-08,creatine kinase B,+-+-,++--++++,-++-+-,0.527533412700556,8.76179208141118e-05,-,0.000175,1.82118e-05,0.0471,0.0471,-0.109,0.0752,0.864,creatine kinase B,dorsal lateral geniculate nucleus,dorsal lateral geniculate nucleus <  dorsal lateral geneiculate nucleus  <  dorsal thalamus  <  thalamus  <  diencephalon  < gray matter,dorsal lateral geniculate nucleus <  dorsal lateral geneiculate nucleus  < dorsal thalamus,Subcommissural organ hypendymal cells,Peripheral sensory neurofilament neurons
ASXL3,2.0589e-06,ASXL transcriptional regulator 3,-+-+,----+++-,+++--+,0.292124043838135,9.29222035961702e-05,-,0.000186,0.002256491,0.05,0.05,-0.109,0.0752,0.787,ASXL transcriptional regulator 3,superior rostral gyrus,superior rostral gyrus <  frontal lobe  <  cerebral cortex  <  telencephalon  < gray matter,superior rostral gyrus < frontal lobe,Cholinergic and monoaminergic neurons,Peripheral sensory non-peptidergic neurons
EXT1,1.2011e-06,exostosin glycosyltransferase 1,-+++,----+++-,++++-+,0.324926576737177,0.000151191975704963,-,0.000302,0.010276231,0.0813,0.0813,-0.109,0.0752,0.81,exostosin glycosyltransferase 1,CA1 field,CA1 field <  hippocampal formation  <  limbic lobe  <  cerebral cortex  <  telencephalon  < gray matter,CA1 field <  hippocampal formation  < limbic lobe,Ependymal cells,Ependymal cells
PSORS1C1,1.7445e-08,psoriasis susceptibility 1 candidate 1,+---,Missing_P_Values,Filtered_Out,0.000233005892605043,0.980482033611947,+,0.000466,0.00337803127868115,0.125,0.125,-0.109,0.0752,0.0512,psoriasis susceptibility 1 candidate 1,temporal pole superior aspect,temporal pole superior aspect <  temporal pole  <  temporal lobe  <  cerebral cortex  <  telencephalon  < gray matter,temporal pole superior aspect <  temporal pole  < temporal lobe,Not_Available,Not_Available
ARHGEF25,1.902e-06,Rho guanine nucleotide exchange factor 25,+-++,+---++++,Not_Available,0.857210873477347,0.000409361630568241,-,0.000819,0.00242952,0.22,0.22,-0.109,0.0752,0.292,Rho guanine nucleotide exchange factor 25,VI paravermis,VI paravermis <  VI  <  Posterior Lobe  <  cerebellar hemispheres  <  cerebellar cortex  <  cerebellum  <  metencephalon  < gray matter,VI paravermis <  VI  <  Posterior Lobe  <  cerebellar hemispheres  < cerebellar cortex,Telencephalon projecting excitatory neurons,Peripheral sensory neurofilament neurons
ITPR3,1.551e-06,"inositol 1,4,5-trisphosphate receptor type 3",++--,++--++++,Filtered_Out,0.453796265142892,0.000430754866904044,-,0.000862,0.001833984,0.232,0.232,-0.109,0.0752,0.733,"inositol 1,4,5-trisphosphate receptor type 3",supraoptic nucleus,supraoptic nucleus <  anterior hypothalamic region  <  hypothalamus  <  diencephalon  < gray matter,supraoptic nucleus < anterior hypothalamic region,Satellite glia,Satellite glia
KMT2A,1.2822e-07,lysine methyltransferase 2A,-+-+,----+---,+++---,0.000525056680034088,0.546649115415953,+,0.00105,0.001785206,0.282,0.282,-0.109,0.0752,0.42,lysine methyltransferase 2A,VIIIB lateral hemisphere,VIIIB lateral hemisphere <  VIIIB  <  Posterior Lobe  <  cerebellar hemispheres  <  cerebellar cortex  <  cerebellum  <  metencephalon  < gray matter,VIIIB lateral hemisphere <  VIIIB  <  Posterior Lobe  <  cerebellar hemispheres  < cerebellar cortex,Cholinergic and monoaminergic neurons,Cholinergic and monoaminergic neurons
KDM3A,1.7641e-09,lysine demethylase 3A,-++-,+++-----,Not_Available,0.000771742858575864,0.735992957357181,+,0.00154,0.005746965,0.415,0.415,-0.109,0.0752,0.316,lysine demethylase 3A,globus pallidus internal segment,globus pallidus internal segment <  globus pallidus  <  basal ganglia  <  cerebral nuclei  <  telencephalon  < gray matter,globus pallidus internal segment <  globus pallidus  < basal ganglia,Ependymal cells,Ependymal cells
LST1,5.4242e-09,leukocyte specific transcript 1,----,+-++++++,----++,0.677639597349466,0.00101746863703139,-,0.00203,0.003058614,0.547,0.547,-0.109,0.0752,0.765,leukocyte specific transcript 1,substantia nigra pars reticulata,substantia nigra pars reticulata <  substantia nigra  <  midbrain tegmentum  <  mesencephalon  < gray matter,substantia nigra pars reticulata < substantia nigra,Not_Available,Not_Available
DENND1A,1.5351e-14,DENN domain containing 1A,+-++,----++++,-++---,0.275625666779975,0.00103934436440108,-,0.00208,0.007451938,0.559,0.559,-0.109,0.0752,0.599,DENN domain containing 1A,basolateral nucleus,basolateral nucleus <  amygdala  <  cerebral nuclei  <  telencephalon  < gray matter,basolateral nucleus < amygdala,Cholinergic and monoaminergic neurons,Cholinergic and monoaminergic neurons
C1QTNF7,2.6076e-06,C1q and TNF related 7,--+-,----+++-,Filtered_Out,0.99068131931168,0.00133232661543979,-,0.00266,0.0176287570112155,0.717,0.717,-0.109,0.0752,0.915,C1q and TNF related 7,central nucleus,central nucleus <  amygdala  <  cerebral nuclei  <  telencephalon  < gray matter,central nucleus < amygdala,Vascular smooth muscle cells,Sympathetic cholinergic neurons
VRK2,9.9697e-09,VRK serine/threonine kinase 2,----,++++---+,---+++,0.14719802238194,0.00148549423972725,-,0.00297,0.027645506,0.799,0.799,-0.109,0.0752,0.546,VRK serine/threonine kinase 2,corpus callosum,corpus callosum <  telencephalic commissures  <  telencephalic white matter  < white matter,corpus callosum < telencephalic commissures,Microglia,Microglia
ZNF638,1.8282e-07,zinc finger protein 638,-+--,+++-+---,Not_Available,0.00153152770772355,0.400658461023316,+,0.00306,0.001959458,0.824,0.824,-0.109,0.0752,0.685,zinc finger protein 638,VIIIB lateral hemisphere,VIIIB lateral hemisphere <  VIIIB  <  Posterior Lobe  <  cerebellar hemispheres  <  cerebellar cortex  <  cerebellum  <  metencephalon  < gray matter,VIIIB lateral hemisphere <  VIIIB  <  Posterior Lobe  <  cerebellar hemispheres  < cerebellar cortex,Not_Available,Not_Available
HIST1H2BN,6.9e-17,Not_Available,----,----++++,Filtered_Out,0.75648752278245,0.00154087150473208,-,0.00308,0.005129735,0.829,0.829,-0.109,0.0752,0.121,Not_Available,III paravermis,III paravermis <  III  <  Anterior Lobe  <  cerebellar hemispheres  <  cerebellar cortex  <  cerebellum  <  metencephalon  < gray matter,III paravermis <  III  <  Anterior Lobe  <  cerebellar hemispheres  < cerebellar cortex,Non-glutamatergic neuroblasts,Non-glutamatergic neuroblasts
ZC3H7B,2.9108e-08,zinc finger CCCH-type containing 7B,+-++,----++++,+++++-,0.0257993920537692,0.00158379955013935,-,0.00317,0.002430993,0.852,0.852,-0.109,0.0752,0.183,zinc finger CCCH-type containing 7B,pontine nuclei,pontine nuclei <  basal part of pons  <  pons  <  metencephalon  < gray matter,pontine nuclei < basal part of pons,Cholinergic and monoaminergic neurons,Sympathetic cholinergic neurons
CDH22,1.8821e-07,cadherin 22,+-+-,+---++++,+++--+,0.19398784368785,0.00195107238644142,-,0.0039,0.012128409,1.05,1,-0.109,0.0752,0.324,cadherin 22,IV,IV <  anterior lobe of the vermis  <  vermis  <  cerebellar cortex  <  cerebellum  <  metencephalon  < gray matter,IV <  anterior lobe of the vermis  <  vermis  < cerebellar cortex,Cholinergic and monoaminergic neurons,Cholinergic and monoaminergic neurons
MYRF,1.6847e-08,myelin regulatory factor,-+--,-+++---+,---+-+,0.0375736696791056,0.00203517294428562,-,0.00407,0.006945037,1.09,1,-0.109,0.0752,0.801,myelin regulatory factor,corpus callosum,corpus callosum <  telencephalic commissures  <  telencephalic white matter  < white matter,corpus callosum < telencephalic commissures,Oligodendrocytes,Oligodendrocytes
SEMA6D,4.0971e-09,semaphorin 6D,-++-,-++-----,+-+-+-,0.00223344524554363,0.599954798645692,+,0.00447,0.00427009,1.2,1,-0.109,0.0752,0.981,semaphorin 6D,substantia nigra pars compacta,substantia nigra pars compacta <  substantia nigra  <  midbrain tegmentum  <  mesencephalon  < gray matter,substantia nigra pars compacta < substantia nigra,Hindbrain neurons,Sympathetic cholinergic neurons
SAMD5,1.2098e-08,sterile alpha motif domain containing 5,----,--------,--+---,0.491365484216639,0.00224748395460516,-,0.00449,0.001158159,1.21,1,-0.109,0.0752,0.882,sterile alpha motif domain containing 5,locus ceruleus,locus ceruleus <  pontine tegmentum  <  pons  <  metencephalon  < gray matter,locus ceruleus < pontine tegmentum,Di- and mesencephalon inhibitory neurons,Enteric neurons
C16orf45,1.8617e-09,Not_Available,+-+-,---+++++,--++-+,0.445086693799803,0.00242226777751679,-,0.00484,0.000958753,1.3,1,-0.109,0.0752,0.584,Not_Available,dentate gyrus,dentate gyrus <  hippocampal formation  <  limbic lobe  <  cerebral cortex  <  telencephalon  < gray matter,dentate gyrus <  hippocampal formation  < limbic lobe,Cholinergic and monoaminergic neurons,Cholinergic and monoaminergic neurons
HS6ST3,1.6614e-08,heparan sulfate 6-O-sulfotransferase 3,++++,-+-++++-,-+---+,0.0029859214744822,0.209831884335215,+,0.00597,0.000472472,1.61,1,-0.109,0.0752,0.72,heparan sulfate 6-O-sulfotransferase 3,dorsal lateral geniculate nucleus,dorsal lateral geniculate nucleus <  dorsal lateral geneiculate nucleus  <  dorsal thalamus  <  thalamus  <  diencephalon  < gray matter,dorsal lateral geniculate nucleus <  dorsal lateral geneiculate nucleus  < dorsal thalamus,Spinal cord inhibitory neurons,Spinal cord inhibitory neurons
GPC5,1.3483e-07,glypican 5,++-+,++++----,++-+-+,0.00378447718872746,0.994760544613885,+,0.00757,0.026207921,2.04,1,-0.109,0.0752,0.768,glypican 5,pontine nuclei,pontine nuclei <  basal part of pons  <  pons  <  metencephalon  < gray matter,pontine nuclei < basal part of pons,Astrocytes,Peripheral sensory non-peptidergic neurons
MIER1,2.6167e-06,MIER1 transcriptional regulator,-+--,++++----,Filtered_Out,0.00423431839209886,0.932624303980461,+,0.00847,0.024035521,2.28,1,-0.109,0.0752,0.398,MIER1 transcriptional regulator,globus pallidus external segment,globus pallidus external segment <  globus pallidus  <  basal ganglia  <  cerebral nuclei  <  telencephalon  < gray matter,globus pallidus external segment <  globus pallidus  < basal ganglia,Pericytes,Enteric neurons
ZNF536,1.6243e-06,zinc finger protein 536,----,-+++---+,---+++,0.342956130633678,0.00450663915668238,-,0.00901,0.0027198308153863,2.42,1,-0.109,0.0752,0.527,zinc finger protein 536,corpus callosum,corpus callosum <  telencephalic commissures  <  telencephalic white matter  < white matter,corpus callosum < telencephalic commissures,Telencephalon inhibitory interneurons,Telencephalon inhibitory interneurons
SGCZ,9.7578e-10,sarcoglycan zeta,-+++,----++++,Filtered_Out,0.947315846685082,0.00479166425080913,-,0.00958,0.003670155,2.58,1,-0.109,0.0752,0.271,sarcoglycan zeta,ventromedial hypothalamic nucleus,ventromedial hypothalamic nucleus <  tuberal region  <  hypothalamus  <  diencephalon  < gray matter,ventromedial hypothalamic nucleus < tuberal region,Cholinergic and monoaminergic neurons,Enteric neurons
MR1,6.2536e-08,"major histocompatibility complex, class I-related",++++,++++----,--+-++,0.00520697951063457,0.271926814705957,+,0.0104,0.03582915938807,2.8,1,-0.109,0.0752,0.814,"major histocompatibility complex, class I-related",central glial substance,central glial substance <  myelencephalon  < gray matter,central glial substance <  myelencephalon  < gray matter,Choroid epithelial cells,Choroid epithelial cells
SPRY2,8.2557e-07,sprouty RTK signaling antagonist 2,+---,--------,++-+--,0.463762999654239,0.00524526623070118,-,0.0105,0.00653533,2.82,1,-0.109,0.0752,0.938,sprouty RTK signaling antagonist 2,IX paravermis,IX paravermis <  IX  <  Posterior Lobe  <  cerebellar hemispheres  <  cerebellar cortex  <  cerebellum  <  metencephalon  < gray matter,IX paravermis <  IX  <  Posterior Lobe  <  cerebellar hemispheres  < cerebellar cortex,Enteric glia,Enteric neurons
MGAT4C,1.2237e-06,MGAT4 family member C,-+++,++------,--+--+,0.00559861517241114,0.896496767576604,+,0.0112,0.002131326,3.01,1,-0.109,0.0752,0.272,MGAT4 family member C,dorsal motor nucleus of the vagus,dorsal motor nucleus of the vagus <  myelencephalon  < gray matter,dorsal motor nucleus of the vagus <  myelencephalon  < gray matter,Cholinergic and monoaminergic neurons,Cholinergic and monoaminergic neurons
ZKSCAN8,2.0086e-13,zinc finger with KRAB and SCAN domains 8,-+-+,+++-----,Filtered_Out,0.0058238543551451,0.973723605194808,+,0.0116,0.037615917,3.13,1,-0.109,0.0752,0.45,zinc finger with KRAB and SCAN domains 8,globus pallidus external segment,globus pallidus external segment <  globus pallidus  <  basal ganglia  <  cerebral nuclei  <  telencephalon  < gray matter,globus pallidus external segment <  globus pallidus  < basal ganglia,Hindbrain neurons,Hindbrain neurons
PCDH9,3.5314e-10,protocadherin 9,-+-+,-+++----,-+++++,0.00585413709697555,0.0603976504629525,+,0.0117,0.004988764,3.15,1,-0.109,0.0752,0.94,protocadherin 9,corpus callosum,corpus callosum <  telencephalic commissures  <  telencephalic white matter  < white matter,corpus callosum < telencephalic commissures,Oligodendrocytes,Oligodendrocytes
EMILIN3,3.3685e-09,elastin microfibril interfacer 3,++++,----++++,-++---,0.00608519132063701,0.588472425616625,+,0.0122,0.02957294,3.27,1,-0.109,0.0752,0.351,elastin microfibril interfacer 3,cuneus striate,cuneus striate <  cuneus  <  occipital lobe  <  cerebral cortex  <  telencephalon  < gray matter,cuneus striate <  cuneus  < occipital lobe,Hindbrain neurons,Peripheral sensory peptidergic neurons
ZNF165,1.9547e-12,zinc finger protein 165,--++,--+-++++,Filtered_Out,0.999419716055649,0.00654088465484309,-,0.0131,0.058737725,3.52,1,-0.109,0.0752,0.958,zinc finger protein 165,dentate nucleus,dentate nucleus <  cerebellar nuclei  <  cerebellum  <  metencephalon  < gray matter,dentate nucleus < cerebellar nuclei,Not_Available,Not_Available
RERE,1.4299e-11,arginine-glutamic acid dipeptide repeats,++++,----++++,+++-+-,0.00706493825300711,0.0103115038305385,+,0.0141,0.00061161,3.8,1,-0.109,0.0752,0.53,arginine-glutamic acid dipeptide repeats,V lateral hemisphere,V lateral hemisphere <  V  <  Anterior Lobe  <  cerebellar hemispheres  <  cerebellar cortex  <  cerebellum  <  metencephalon  < gray matter,V lateral hemisphere <  V  <  Anterior Lobe  <  cerebellar hemispheres  < cerebellar cortex,Cholinergic and monoaminergic neurons,Sympathetic cholinergic neurons
RFTN2,5.4058e-07,raftlin family member 2,----,++++----,---+++,0.033166164956789,0.00777022883351452,-,0.0155,0.0124360073754275,4.18,1,-0.109,0.0752,0.444,raftlin family member 2,corpus callosum,corpus callosum <  telencephalic commissures  <  telencephalic white matter  < white matter,corpus callosum < telencephalic commissures,Enteric glia,Enteric glia
CRB1,2.4995e-07,crumbs cell polarity complex component 1,++-+,+++-----,++-+-+,0.00777064919610453,0.970339061777031,+,0.0155,0.000989607,4.18,1,-0.109,0.0752,0.623,crumbs cell polarity complex component 1,central glial substance,central glial substance <  myelencephalon  < gray matter,central glial substance <  myelencephalon  < gray matter,Cholinergic and monoaminergic neurons,Cholinergic and monoaminergic neurons
HIST1H2BF,3.5839e-08,Not_Available,--++,++++++++,Filtered_Out,0.984224010374289,0.00870182527908634,-,0.0174,0.01036763,4.68,1,-0.109,0.0752,Not_Available,Not_Available,central glial substance,central glial substance <  myelencephalon  < gray matter,central glial substance <  myelencephalon  < gray matter,Ependymal cells,Ependymal cells
CTNND1,7.753e-08,catenin delta 1,-+-+,----+-+-,----+-,0.549817839164186,0.00964922527836749,-,0.0193,0.001687079,5.19,1,-0.109,0.0752,Not_Available,catenin delta 1,central glial substance,central glial substance <  myelencephalon  < gray matter,central glial substance <  myelencephalon  < gray matter,Pericytes,Peripheral sensory non-peptidergic neurons
CAMKK2,1.8833e-06,calcium/calmodulin dependent protein kinase kinase 2,+++-,-+-+++++,++----,0.0112066635001301,0.201628735226378,+,0.0224,0.002338858,6.03,1,-0.109,0.0752,0.565,calcium/calmodulin dependent protein kinase kinase 2,IX paravermis,IX paravermis <  IX  <  Posterior Lobe  <  cerebellar hemispheres  <  cerebellar cortex  <  cerebellum  <  metencephalon  < gray matter,IX paravermis <  IX  <  Posterior Lobe  <  cerebellar hemispheres  < cerebellar cortex,Telencephalon projecting excitatory neurons,Telencephalon projecting excitatory neurons
RBFOX1,6.0939e-17,RNA binding fox-1 homolog 1,++++,---+++++,++----,0.0121486474544125,0.43935892343116,+,0.0243,0.027298127,6.54,1,-0.109,0.0752,0.717,RNA binding fox-1 homolog 1,dentate gyrus,dentate gyrus <  hippocampal formation  <  limbic lobe  <  cerebral cortex  <  telencephalon  < gray matter,dentate gyrus <  hippocampal formation  < limbic lobe,Telencephalon projecting excitatory neurons,Peripheral sensory non-peptidergic neurons
PLCL1,7.7924e-07,phospholipase C like 1 (inactive),-+--,++++----,-----+,0.0127292443666422,0.225669818740638,+,0.0255,0.019769308,6.85,1,-0.109,0.0752,0.831,phospholipase C like 1 (inactive),inferior olivary complex,inferior olivary complex <  myelencephalon  < gray matter,inferior olivary complex <  myelencephalon  < gray matter,Oligodendrocytes,Oligodendrocytes
PCNP,2.3346e-07,PEST proteolytic signal containing nuclear protein,-+++,++-+-+-+,---+-+,0.644919266166728,0.012767118050389,-,0.0255,0.013082865,6.87,1,-0.109,0.0752,0.406,PEST proteolytic signal containing nuclear protein,globus pallidus external segment,globus pallidus external segment <  globus pallidus  <  basal ganglia  <  cerebral nuclei  <  telencephalon  < gray matter,globus pallidus external segment <  globus pallidus  < basal ganglia,Cholinergic and monoaminergic neurons,Enteric neurons
ANKS1B,1.5029e-06,ankyrin repeat and sterile alpha motif domain containing 1B,-+++,----++--,--++++,0.754293044287807,0.0133651384822094,-,0.0267,0.008015543,7.19,1,-0.109,0.0752,0.695,ankyrin repeat and sterile alpha motif domain containing 1B,CA1 field,CA1 field <  hippocampal formation  <  limbic lobe  <  cerebral cortex  <  telencephalon  < gray matter,CA1 field <  hippocampal formation  < limbic lobe,Oligodendrocytes,Oligodendrocytes
FADS1,1.2518e-07,fatty acid desaturase 1,++--,+++-----,--++-+,0.0146636031923265,0.647198181132259,+,0.0293,0.071401741,7.89,1,-0.109,0.0752,0.866,fatty acid desaturase 1,central glial substance,central glial substance <  myelencephalon  < gray matter,central glial substance <  myelencephalon  < gray matter,Satellite glia,Satellite glia
DCDC1,7.4612e-09,doublecortin domain containing 1,++-+,+++++---,Filtered_Out,0.0167103081724795,0.996111521033758,+,0.0334,0.026863188,8.99,1,-0.109,0.0752,Not_Available,doublecortin domain containing 1,central glial substance,central glial substance <  myelencephalon  < gray matter,central glial substance <  myelencephalon  < gray matter,Not_Available,Not_Available
DCDC1,7.4612e-09,doublecortin domain containing 1,++-+,+++++---,Filtered_Out,0.0167103081724795,0.996111521033758,+,0.0334,0.026863188,8.99,1,-0.109,0.0752,Not_Available,doublecortin domain containing 1,central glial substance,central glial substance <  myelencephalon  < gray matter,central glial substance <  myelencephalon  < gray matter,Not_Available,Not_Available
DCDC5,2.4868e-09,Not_Available,Not_Available,Not_Available,Not_Available,0.0167103081724795,0.996111521033758,+,0.0334,0.026863188,8.99,1,-0.109,0.0752,0.306,Not_Available,central glial substance,central glial substance <  myelencephalon  < gray matter,central glial substance <  myelencephalon  < gray matter,Not_Available,Not_Available
MARK3,2.6768e-07,microtubule affinity regulating kinase 3,+++-,+-+-+---,+-++--,0.0172602215453493,0.944888620710555,+,0.0345,0.034033973,9.29,1,-0.109,0.0752,0.125,microtubule affinity regulating kinase 3,III paravermis,III paravermis <  III  <  Anterior Lobe  <  cerebellar hemispheres  <  cerebellar cortex  <  cerebellum  <  metencephalon  < gray matter,III paravermis <  III  <  Anterior Lobe  <  cerebellar hemispheres  < cerebellar cortex,Hindbrain neurons,Peripheral sensory neurofilament neurons
HLA-B,4.3342e-11,"major histocompatibility complex, class I, B",+-+-,++++++++,+--+--,0.423208621467463,0.0180076677982794,-,0.036,0.005617603,9.69,1,-0.109,0.0752,0.771,"major histocompatibility complex, class I, B",supraoptic nucleus,supraoptic nucleus <  anterior hypothalamic region  <  hypothalamus  <  diencephalon  < gray matter,supraoptic nucleus < anterior hypothalamic region,Not_Available,Not_Available
RABEPK,1.5581e-06,Rab9 effector protein with kelch motifs,+-+-,-++-++++,-----+,0.639807677657255,0.018398194232636,-,0.0368,0.011639513,9.9,1,-0.109,0.0752,0.136,Rab9 effector protein with kelch motifs,zona incerta,zona incerta <  ventral thalamus  <  thalamus  <  diencephalon  < gray matter,zona incerta <  ventral thalamus  < thalamus,Telencephalon inhibitory interneurons,Sympathetic cholinergic neurons
ETFDH,1.4397e-06,electron transfer flavoprotein dehydrogenase,++-+,+++-+---,+-+-++,0.0217655953225317,0.366317895921566,+,0.0435,0.007798596,11.7,1,-0.109,0.0752,0.678,electron transfer flavoprotein dehydrogenase,globus pallidus internal segment,globus pallidus internal segment <  globus pallidus  <  basal ganglia  <  cerebral nuclei  <  telencephalon  < gray matter,globus pallidus internal segment <  globus pallidus  < basal ganglia,Choroid epithelial cells,Sympathetic cholinergic neurons
AREL1,3.0386e-08,apoptosis resistant E3 ubiquitin protein ligase 1,++++,--------,-+++--,0.023028195550518,0.903784029083508,+,0.0461,0.023507959,12.4,1,-0.109,0.0752,0.305,apoptosis resistant E3 ubiquitin protein ligase 1,V,V <  anterior lobe of the vermis  <  vermis  <  cerebellar cortex  <  cerebellum  <  metencephalon  < gray matter,V <  anterior lobe of the vermis  <  vermis  < cerebellar cortex,Telencephalon projecting inhibitory neurons,Sympathetic noradrenergic neurons
MEGF11,1.7823e-10,multiple EGF like domains 11,++-+,+++-++--,Filtered_Out,0.0232253808352923,0.921604707356406,+,0.0465,0.0156899468749612,12.5,1,-0.109,0.0752,0.84,multiple EGF like domains 11,lateral mammillary nucleus,lateral mammillary nucleus <  mammillary body  <  mammillary region  <  hypothalamus  <  diencephalon  < gray matter,lateral mammillary nucleus <  mammillary body  < mammillary region,Oligodendrocyte precursor cells,Oligodendrocyte precursor cells
RPS6KL1,1.0121e-07,ribosomal protein S6 kinase like 1,+-+-,----++++,--++--,0.328263967541023,0.0232886857511899,-,0.0466,0.008210583,12.5,1,-0.109,0.0752,0.242,ribosomal protein S6 kinase like 1,V,V <  anterior lobe of the vermis  <  vermis  <  cerebellar cortex  <  cerebellum  <  metencephalon  < gray matter,V <  anterior lobe of the vermis  <  vermis  < cerebellar cortex,Cholinergic and monoaminergic neurons,Sympathetic noradrenergic neurons
CELF4,8.7511e-10,CUGBP Elav-like family member 4,+--+,+----+++,-+-+-+,0.893741098361468,0.0235648256610189,-,0.0471,0.032633708,12.7,1,-0.109,0.0752,0.739,CUGBP Elav-like family member 4,dentate gyrus,dentate gyrus <  hippocampal formation  <  limbic lobe  <  cerebral cortex  <  telencephalon  < gray matter,dentate gyrus <  hippocampal formation  < limbic lobe,Cholinergic and monoaminergic neurons,Cholinergic and monoaminergic neurons
ZDHHC21,7.4997e-09,zinc finger DHHC-type palmitoyltransferase 21,++++,-+------,---++-,0.0238319137130882,0.242807626651096,+,0.0477,0.014756273,12.8,1,-0.109,0.0752,0.752,zinc finger DHHC-type palmitoyltransferase 21,VIIIB lateral hemisphere,VIIIB lateral hemisphere <  VIIIB  <  Posterior Lobe  <  cerebellar hemispheres  <  cerebellar cortex  <  cerebellum  <  metencephalon  < gray matter,VIIIB lateral hemisphere <  VIIIB  <  Posterior Lobe  <  cerebellar hemispheres  < cerebellar cortex,Hindbrain neurons,Peripheral sensory neurofilament neurons
HARS2,1.3511e-06,"histidyl-tRNA synthetase 2, mitochondrial",++++,+++--++-,+++---,0.0245114597453278,0.990877349755551,+,0.049,0.03920618,13.2,1,-0.109,0.0752,0.143,"histidyl-tRNA synthetase 2, mitochondrial",VIIIB lateral hemisphere,VIIIB lateral hemisphere <  VIIIB  <  Posterior Lobe  <  cerebellar hemispheres  <  cerebellar cortex  <  cerebellum  <  metencephalon  < gray matter,VIIIB lateral hemisphere <  VIIIB  <  Posterior Lobe  <  cerebellar hemispheres  < cerebellar cortex,Cholinergic and monoaminergic neurons,Cholinergic and monoaminergic neurons
