gene_symbol,Howard_pvalue,gene_name.x,RamakerDir,LabonteDir,DingDir,meta_meta_higher_in_MDD_genome_percentile_rank,meta_meta_lower_in_MDD_genome_percentile_rank,meta_direction,meta_empirical_p,minp,Spearman_corr,Spearman_p,Corrected_meta_empirical_p,Bonferroni_meta_empirical_p,DE_Prior_Rank,gene_name.y,brain_region,region_location,slim_region_location,cns_cell_type_taxon,cell_type_taxon
INPP4B,3.7112e-07,inositol polyphosphate-4-phosphatase type II B,+-,---+,--,0.254458137699458,0.227468994056281,-,0.455,0.134191386,0.0191,0.755,122,1,0.888,inositol polyphosphate-4-phosphatase type II B,basal nucleus of meynert,basal nucleus of meynert <  substantia innominata  <  basal forebrain  <  cerebral nuclei  <  telencephalon  < gray matter,basal nucleus of meynert <  substantia innominata  < basal forebrain,Cholinergic and monoaminergic neurons,Cholinergic and monoaminergic neurons
BTN3A2,3.9579e-13,butyrophilin subfamily 3 member A2,-+,----,+-,0.288550125893162,0.227958561314827,-,0.456,0.177430669231188,0.0191,0.755,123,1,0.845,butyrophilin subfamily 3 member A2,supraoptic nucleus,supraoptic nucleus <  anterior hypothalamic region  <  hypothalamus  <  diencephalon  < gray matter,supraoptic nucleus < anterior hypothalamic region,Not_Available,Not_Available
PCNP,2.3346e-07,PEST proteolytic signal containing nuclear protein,+-,-+-+,--,0.278703232609435,0.230649528312536,-,0.461,0.146137172,0.0191,0.755,124,1,0.406,PEST proteolytic signal containing nuclear protein,globus pallidus external segment,globus pallidus external segment <  globus pallidus  <  basal ganglia  <  cerebral nuclei  <  telencephalon  < gray matter,globus pallidus external segment <  globus pallidus  < basal ganglia,Cholinergic and monoaminergic neurons,Enteric neurons
PCDHA6,6.7865e-07,protocadherin alpha 6,+-,++--,Filtered_Out,0.300128279569676,0.235620252770465,-,0.471,0.132236093836804,0.0191,0.755,127,1,0.054,protocadherin alpha 6,VIIIB lateral hemisphere,VIIIB lateral hemisphere <  VIIIB  <  Posterior Lobe  <  cerebellar hemispheres  <  cerebellar cortex  <  cerebellum  <  metencephalon  < gray matter,VIIIB lateral hemisphere <  VIIIB  <  Posterior Lobe  <  cerebellar hemispheres  < cerebellar cortex,Cholinergic and monoaminergic neurons,Cholinergic and monoaminergic neurons
FNIP2,7.2185e-07,folliculin interacting protein 2,--,+---,Not_Available,0.333426198876805,0.237169728729979,-,0.474,0.035121073,0.0191,0.755,128,1,0.742,folliculin interacting protein 2,corpus callosum,corpus callosum <  telencephalic commissures  <  telencephalic white matter  < white matter,corpus callosum < telencephalic commissures,Enteric glia,Sympathetic cholinergic neurons
BTN3A3,6.5955e-08,butyrophilin subfamily 3 member A3,+-,++-+,-+,0.277895528801576,0.238083454102724,-,0.476,0.021741573,0.0191,0.755,128,1,0.829,butyrophilin subfamily 3 member A3,supraoptic nucleus,supraoptic nucleus <  anterior hypothalamic region  <  hypothalamus  <  diencephalon  < gray matter,supraoptic nucleus < anterior hypothalamic region,Not_Available,Not_Available
TMEM161B,4.7697e-14,transmembrane protein 161B,--,-++-,++,0.27093154511621,0.239285323549805,-,0.479,0.21800232,0.0191,0.755,129,1,0.572,transmembrane protein 161B,VIIIB lateral hemisphere,VIIIB lateral hemisphere <  VIIIB  <  Posterior Lobe  <  cerebellar hemispheres  <  cerebellar cortex  <  cerebellum  <  metencephalon  < gray matter,VIIIB lateral hemisphere <  VIIIB  <  Posterior Lobe  <  cerebellar hemispheres  < cerebellar cortex,Hindbrain neurons,Hindbrain neurons
TAL1,5.7321e-07,"TAL bHLH transcription factor 1, erythroid differentiation factor",-+,++-+,Filtered_Out,0.343089026063054,0.24199864649816,-,0.484,0.117610401,0.0191,0.755,130,1,0.888,"TAL bHLH transcription factor 1, erythroid differentiation factor",superior olivary complex,superior olivary complex <  pontine tegmentum  <  pons  <  metencephalon  < gray matter,superior olivary complex < pontine tegmentum,Di- and mesencephalon inhibitory neurons,Di- and mesencephalon inhibitory neurons
ANKHD1,2.0799e-06,ankyrin repeat and KH domain containing 1,-+,+++-,Filtered_Out,0.361433438642533,0.244620530076091,-,0.489,0.136400031,0.0191,0.755,132,1,Not_Available,ankyrin repeat and KH domain containing 1,IV lateral hemisphere,IV lateral hemisphere <  IV  <  Anterior Lobe  <  cerebellar hemispheres  <  cerebellar cortex  <  cerebellum  <  metencephalon  < gray matter,IV lateral hemisphere <  IV  <  Anterior Lobe  <  cerebellar hemispheres  < cerebellar cortex,Hindbrain neurons,Enteric neurons
RANGAP1,3.067e-08,Ran GTPase activating protein 1,-+,+-++,--,0.307630738213629,0.250012594466079,-,0.5,0.041305725,0.0191,0.755,135,1,0.525,Ran GTPase activating protein 1,supramarginal gyrus superior bank of gyrus,supramarginal gyrus superior bank of gyrus <  supramarginal gyrus  <  inferior parietal lobule  <  parietal lobe  <  cerebral cortex  <  telencephalon  < gray matter,supramarginal gyrus superior bank of gyrus <  supramarginal gyrus  <  inferior parietal lobule  < parietal lobe,Cholinergic and monoaminergic neurons,Cholinergic and monoaminergic neurons
PCDHA7,2.2519e-06,protocadherin alpha 7,++,+-++,Not_Available,0.314875007108663,0.251794127942547,-,0.504,0.30729888499638,0.0191,0.755,135,1,Not_Available,protocadherin alpha 7,midbrain raphe nuclei,midbrain raphe nuclei <  midbrain tegmentum  <  mesencephalon  < gray matter,midbrain raphe nuclei < midbrain tegmentum,Hindbrain neurons,Hindbrain neurons
HIST1H3J,1.093e-14,Not_Available,-+,Not_Available,Filtered_Out,0.275252381223978,0.251996349532284,-,0.504,0.187097426757102,0.0191,0.755,136,1,0.0751,Not_Available,VI,VI <  posterior lobe of the vermis  <  vermis  <  cerebellar cortex  <  cerebellum  <  metencephalon  < gray matter,VI <  posterior lobe of the vermis  <  vermis  < cerebellar cortex,Non-glutamatergic neuroblasts,Non-glutamatergic neuroblasts
DLST,8.8708e-10,dihydrolipoamide S-succinyltransferase,+-,++++,Not_Available,0.366058482830828,0.255601816090554,-,0.511,0.260601522,0.0191,0.755,138,1,0.26,dihydrolipoamide S-succinyltransferase,dorsal lateral geniculate nucleus,dorsal lateral geniculate nucleus <  dorsal lateral geneiculate nucleus  <  dorsal thalamus  <  thalamus  <  diencephalon  < gray matter,dorsal lateral geniculate nucleus <  dorsal lateral geneiculate nucleus  < dorsal thalamus,Hindbrain neurons,Peripheral sensory neurofilament neurons
TMEM258,5.5471e-07,transmembrane protein 258,-+,+++-,++,0.280194863156169,0.256034632791969,-,0.512,0.0947934899536737,0.0191,0.755,138,1,0.218,transmembrane protein 258,corpus callosum,corpus callosum <  telencephalic commissures  <  telencephalic white matter  < white matter,corpus callosum < telencephalic commissures,Oligodendrocytes,Sympathetic noradrenergic neurons
CELF2,7.5152e-08,CUGBP Elav-like family member 2,+-,----,-+,0.313917163241779,0.256969587343137,-,0.514,0.166449719,0.0191,0.755,138,1,0.948,CUGBP Elav-like family member 2,lateral group of nuclei ventral division,lateral group of nuclei ventral division <  lateral group of nuclei  <  dorsal thalamus  <  thalamus  <  diencephalon  < gray matter,lateral group of nuclei ventral division <  lateral group of nuclei  < dorsal thalamus,Telencephalon projecting excitatory neurons,Telencephalon projecting excitatory neurons
DRD2,5.3507e-14,dopamine receptor D2,+-,+-+-,Not_Available,0.318700878962684,0.258192621586461,-,0.516,0.118865096035546,0.0191,0.755,139,1,0.439,dopamine receptor D2,substantia nigra pars compacta,substantia nigra pars compacta <  substantia nigra  <  midbrain tegmentum  <  mesencephalon  < gray matter,substantia nigra pars compacta < substantia nigra,Telencephalon projecting inhibitory neurons,Telencephalon projecting inhibitory neurons
TMEM42,4.8697e-07,transmembrane protein 42,-+,++++,Not_Available,0.372761655650185,0.263451863351154,-,0.527,0.209431463,0.0191,0.755,142,1,0.325,transmembrane protein 42,corpus callosum,corpus callosum <  telencephalic commissures  <  telencephalic white matter  < white matter,corpus callosum < telencephalic commissures,Telencephalon projecting excitatory neurons,Peripheral sensory non-peptidergic neurons
ZNF660,2.4714e-10,zinc finger protein 660,-+,--++,Filtered_Out,0.348006533844093,0.265144854680132,-,0.53,0.131673996,0.0191,0.755,143,1,0.142,zinc finger protein 660,central glial substance,central glial substance <  myelencephalon  < gray matter,central glial substance <  myelencephalon  < gray matter,Not_Available,Not_Available
CACNA1E,2.8558e-11,calcium voltage-gated channel subunit alpha1 E,+-,-++-,-+,0.315405949902204,0.265458955729106,-,0.531,0.078153531,0.0191,0.755,143,1,0.753,calcium voltage-gated channel subunit alpha1 E,inferior olivary complex,inferior olivary complex <  myelencephalon  < gray matter,inferior olivary complex <  myelencephalon  < gray matter,Telencephalon projecting excitatory neurons,Telencephalon projecting excitatory neurons
TAOK3,1.4896e-08,TAO kinase 3,-+,--++,-+,0.316590618867277,0.267560885922893,-,0.535,0.068643352,0.0191,0.755,144,1,0.531,TAO kinase 3,globus pallidus external segment,globus pallidus external segment <  globus pallidus  <  basal ganglia  <  cerebral nuclei  <  telencephalon  < gray matter,globus pallidus external segment <  globus pallidus  < basal ganglia,Cholinergic and monoaminergic neurons,Peripheral sensory non-peptidergic neurons
USP3,2.4852e-06,ubiquitin specific peptidase 3,--,++--,-+,0.329201887617529,0.274465075342984,-,0.549,0.063654401,0.0191,0.755,148,1,0.564,ubiquitin specific peptidase 3,V lateral hemisphere,V lateral hemisphere <  V  <  Anterior Lobe  <  cerebellar hemispheres  <  cerebellar cortex  <  cerebellum  <  metencephalon  < gray matter,V lateral hemisphere <  V  <  Anterior Lobe  <  cerebellar hemispheres  < cerebellar cortex,Hindbrain neurons,Enteric neurons
KIAA1143,4.9967e-07,KIAA1143,+-,++--,--,0.323418497721214,0.276336296201454,-,0.553,0.118561363,0.0191,0.755,149,1,0.409,KIAA1143,locus ceruleus,locus ceruleus <  pontine tegmentum  <  pons  <  metencephalon  < gray matter,locus ceruleus < pontine tegmentum,Telencephalon projecting excitatory neurons,Sympathetic noradrenergic neurons
HIST1H2BN,6.9e-17,Not_Available,-+,--++,Filtered_Out,0.393048455441046,0.276605346522638,-,0.553,0.045282924,0.0191,0.755,149,1,0.121,Not_Available,III paravermis,III paravermis <  III  <  Anterior Lobe  <  cerebellar hemispheres  <  cerebellar cortex  <  cerebellum  <  metencephalon  < gray matter,III paravermis <  III  <  Anterior Lobe  <  cerebellar hemispheres  < cerebellar cortex,Non-glutamatergic neuroblasts,Non-glutamatergic neuroblasts
NRG1,9.6427e-10,neuregulin 1,--,-+++,-+,0.313053950556473,0.276783191698094,-,0.554,0.156002434,0.0191,0.755,149,1,0.928,neuregulin 1,basal nucleus of meynert,basal nucleus of meynert <  substantia innominata  <  basal forebrain  <  cerebral nuclei  <  telencephalon  < gray matter,basal nucleus of meynert <  substantia innominata  < basal forebrain,Not_Available,Not_Available
RERE,1.4299e-11,arginine-glutamic acid dipeptide repeats,+-,--++,+-,0.325514247919865,0.277432298442248,-,0.555,0.057444288,0.0191,0.755,149,1,0.53,arginine-glutamic acid dipeptide repeats,V lateral hemisphere,V lateral hemisphere <  V  <  Anterior Lobe  <  cerebellar hemispheres  <  cerebellar cortex  <  cerebellum  <  metencephalon  < gray matter,V lateral hemisphere <  V  <  Anterior Lobe  <  cerebellar hemispheres  < cerebellar cortex,Cholinergic and monoaminergic neurons,Sympathetic cholinergic neurons
ZHX3,2.344e-07,zinc fingers and homeoboxes 3,+-,--+-,++,0.32107964945714,0.280433903624194,-,0.561,0.087707865,0.0191,0.755,151,1,0.409,zinc fingers and homeoboxes 3,globus pallidus internal segment,globus pallidus internal segment <  globus pallidus  <  basal ganglia  <  cerebral nuclei  <  telencephalon  < gray matter,globus pallidus internal segment <  globus pallidus  < basal ganglia,Cholinergic and monoaminergic neurons,Cholinergic and monoaminergic neurons
HIST1H2BO,9.6505e-08,Not_Available,-+,Not_Available,Filtered_Out,0.327686516084873,0.292362972680089,-,0.585,0.251346298809773,0.0191,0.755,157,1,0.528,Not_Available,III paravermis,III paravermis <  III  <  Anterior Lobe  <  cerebellar hemispheres  <  cerebellar cortex  <  cerebellum  <  metencephalon  < gray matter,III paravermis <  III  <  Anterior Lobe  <  cerebellar hemispheres  < cerebellar cortex,Ependymal cells,Ependymal cells
ANKHD1-EIF4EBP3,2.5326e-06,ANKHD1-EIF4EBP3 readthrough,--,--++,Not_Available,0.382341970311908,0.305592772771066,-,0.611,0.291716720554046,0.0191,0.755,164,1,Not_Available,ANKHD1-EIF4EBP3 readthrough,VIIIB lateral hemisphere,VIIIB lateral hemisphere <  VIIIB  <  Posterior Lobe  <  cerebellar hemispheres  <  cerebellar cortex  <  cerebellum  <  metencephalon  < gray matter,VIIIB lateral hemisphere <  VIIIB  <  Posterior Lobe  <  cerebellar hemispheres  < cerebellar cortex,Hindbrain neurons,Enteric neurons
EPHB2,1.0438e-06,EPH receptor B2,--,++--,+-,0.373804820669161,0.30703104251408,-,0.614,0.135571822,0.0191,0.755,165,1,0.805,EPH receptor B2,corpus callosum,corpus callosum <  telencephalic commissures  <  telencephalic white matter  < white matter,corpus callosum < telencephalic commissures,Enteric glia,Enteric glia
RAB3B,1.6111e-06,"RAB3B, member RAS oncogene family",++,+--+,--,0.365900441923864,0.309127500667641,-,0.618,0.14063965,0.0191,0.755,166,1,0.954,"RAB3B, member RAS oncogene family",nucleus of the diagonal band horizontal division,nucleus of the diagonal band horizontal division <  nucleus of the diagonal band  <  substantia innominata  <  basal forebrain  <  cerebral nuclei  <  telencephalon  < gray matter,nucleus of the diagonal band horizontal division <  nucleus of the diagonal band  <  substantia innominata  < basal forebrain,Glutamatergic neuroblasts,Sympathetic noradrenergic neurons
ZNF501,5.3546e-07,zinc finger protein 501,+-,--++,Filtered_Out,0.386770175974495,0.311059824953113,-,0.622,0.237736354660351,0.0191,0.755,167,1,0.179,zinc finger protein 501,VIIIB lateral hemisphere,VIIIB lateral hemisphere <  VIIIB  <  Posterior Lobe  <  cerebellar hemispheres  <  cerebellar cortex  <  cerebellum  <  metencephalon  < gray matter,VIIIB lateral hemisphere <  VIIIB  <  Posterior Lobe  <  cerebellar hemispheres  < cerebellar cortex,Not_Available,Not_Available
PLCL1,7.7924e-07,phospholipase C like 1 (inactive),--,++-+,+-,0.378959669601782,0.312452112058133,-,0.625,0.289312892,0.0191,0.755,168,1,0.831,phospholipase C like 1 (inactive),inferior olivary complex,inferior olivary complex <  myelencephalon  < gray matter,inferior olivary complex <  myelencephalon  < gray matter,Oligodendrocytes,Oligodendrocytes
RBFOX1,6.0939e-17,RNA binding fox-1 homolog 1,+-,+++-,++,0.358227368227631,0.312899379978219,-,0.626,0.102405993,0.0191,0.755,168,1,0.717,RNA binding fox-1 homolog 1,dentate gyrus,dentate gyrus <  hippocampal formation  <  limbic lobe  <  cerebral cortex  <  telencephalon  < gray matter,dentate gyrus <  hippocampal formation  < limbic lobe,Telencephalon projecting excitatory neurons,Peripheral sensory non-peptidergic neurons
RABEPK,1.5581e-06,Rab9 effector protein with kelch motifs,-+,--++,-+,0.345650137813086,0.314070639388642,-,0.628,0.12550721,0.0191,0.755,169,1,0.136,Rab9 effector protein with kelch motifs,zona incerta,zona incerta <  ventral thalamus  <  thalamus  <  diencephalon  < gray matter,zona incerta <  ventral thalamus  < thalamus,Telencephalon inhibitory interneurons,Sympathetic cholinergic neurons
ZFHX4,5.2705e-09,zinc finger homeobox 4,+-,++++,-+,0.370284007068171,0.315697623057962,-,0.631,0.255417595782872,0.0191,0.755,170,1,0.799,zinc finger homeobox 4,subthalamic nucleus,subthalamic nucleus <  subthalamus  <  diencephalon  < gray matter,subthalamic nucleus < subthalamus,Cholinergic and monoaminergic neurons,Cholinergic and monoaminergic neurons
AREL1,3.0386e-08,apoptosis resistant E3 ubiquitin protein ligase 1,+-,+++-,++,0.352456356437746,0.317125156399619,-,0.634,0.107144209682817,0.0191,0.755,171,1,0.305,apoptosis resistant E3 ubiquitin protein ligase 1,V,V <  anterior lobe of the vermis  <  vermis  <  cerebellar cortex  <  cerebellum  <  metencephalon  < gray matter,V <  anterior lobe of the vermis  <  vermis  < cerebellar cortex,Telencephalon projecting inhibitory neurons,Sympathetic noradrenergic neurons
CDH22,1.8821e-07,cadherin 22,-+,+--+,-+,0.379773083710749,0.318074898516197,-,0.636,0.101395734,0.0191,0.755,171,1,0.324,cadherin 22,IV,IV <  anterior lobe of the vermis  <  vermis  <  cerebellar cortex  <  cerebellum  <  metencephalon  < gray matter,IV <  anterior lobe of the vermis  <  vermis  < cerebellar cortex,Cholinergic and monoaminergic neurons,Cholinergic and monoaminergic neurons
ZNF197,2.2773e-10,zinc finger protein 197,++,-+-+,Filtered_Out,0.400598281738167,0.318231190765962,-,0.636,0.323336523041204,0.0191,0.755,171,1,0.249,zinc finger protein 197,VIIIB lateral hemisphere,VIIIB lateral hemisphere <  VIIIB  <  Posterior Lobe  <  cerebellar hemispheres  <  cerebellar cortex  <  cerebellum  <  metencephalon  < gray matter,VIIIB lateral hemisphere <  VIIIB  <  Posterior Lobe  <  cerebellar hemispheres  < cerebellar cortex,Not_Available,Not_Available
OTX2,8.9134e-07,orthodenticle homeobox 2,-+,Missing_P_Values,Filtered_Out,0.359493526492899,0.319815195071869,-,0.64,0.291562414659215,0.0191,0.755,172,1,0.728,orthodenticle homeobox 2,superior colliculus,superior colliculus <  midbrain tectum  <  mesencephalon  < gray matter,superior colliculus < midbrain tectum,Choroid epithelial cells,Choroid epithelial cells
RPS6KL1,1.0121e-07,ribosomal protein S6 kinase like 1,-+,+-++,++,0.363747699531206,0.322763115333142,-,0.646,0.094638677,0.0191,0.755,174,1,0.242,ribosomal protein S6 kinase like 1,V,V <  anterior lobe of the vermis  <  vermis  <  cerebellar cortex  <  cerebellum  <  metencephalon  < gray matter,V <  anterior lobe of the vermis  <  vermis  < cerebellar cortex,Cholinergic and monoaminergic neurons,Sympathetic noradrenergic neurons
XRCC3,3.7865e-09,X-ray repair cross complementing 3,--,--++,Filtered_Out,0.400483188782877,0.325641325605128,-,0.651,0.28832624553154,0.0191,0.755,175,1,0.396,X-ray repair cross complementing 3,IX,IX <  posterior lobe of the vermis  <  vermis  <  cerebellar cortex  <  cerebellum  <  metencephalon  < gray matter,IX <  posterior lobe of the vermis  <  vermis  < cerebellar cortex,Oligodendrocytes,Oligodendrocytes
DENND1A,1.5351e-14,DENN domain containing 1A,+-,--++,-+,0.376739430087367,0.336254298321996,-,0.673,0.206185712082643,0.0191,0.755,181,1,0.599,DENN domain containing 1A,basolateral nucleus,basolateral nucleus <  amygdala  <  cerebral nuclei  <  telencephalon  < gray matter,basolateral nucleus < amygdala,Cholinergic and monoaminergic neurons,Cholinergic and monoaminergic neurons
ZSCAN12,8.579e-11,zinc finger and SCAN domain containing 12,+-,+-++,Filtered_Out,0.442658619631124,0.339308147313176,-,0.679,0.294296804486203,0.0191,0.755,183,1,0.374,zinc finger and SCAN domain containing 12,VIIIB lateral hemisphere,VIIIB lateral hemisphere <  VIIIB  <  Posterior Lobe  <  cerebellar hemispheres  <  cerebellar cortex  <  cerebellum  <  metencephalon  < gray matter,VIIIB lateral hemisphere <  VIIIB  <  Posterior Lobe  <  cerebellar hemispheres  < cerebellar cortex,Subcommissural organ hypendymal cells,Sympathetic cholinergic neurons
SDK1,9.1946e-09,sidekick cell adhesion molecule 1,++,++--,Filtered_Out,0.453956699565609,0.339353247510822,-,0.679,0.149923686,0.0191,0.755,183,1,0.705,sidekick cell adhesion molecule 1,CA3 field,CA3 field <  hippocampal formation  <  limbic lobe  <  cerebral cortex  <  telencephalon  < gray matter,CA3 field <  hippocampal formation  < limbic lobe,Cholinergic and monoaminergic neurons,Peripheral sensory peptidergic neurons
ZCCHC7,4.1883e-12,zinc finger CCHC-type containing 7,+-,--++,++,0.409294289143083,0.341601370416649,-,0.683,0.110438212,0.0191,0.755,184,1,0.646,zinc finger CCHC-type containing 7,dentate gyrus,dentate gyrus <  hippocampal formation  <  limbic lobe  <  cerebral cortex  <  telencephalon  < gray matter,dentate gyrus <  hippocampal formation  < limbic lobe,Hindbrain neurons,Hindbrain neurons
PRR16,1.185e-06,proline rich 16,+-,+--+,Filtered_Out,0.459381332277578,0.343991905015776,-,0.688,0.144810094,0.0191,0.755,185,1,0.87,proline rich 16,VIIIB lateral hemisphere,VIIIB lateral hemisphere <  VIIIB  <  Posterior Lobe  <  cerebellar hemispheres  <  cerebellar cortex  <  cerebellum  <  metencephalon  < gray matter,VIIIB lateral hemisphere <  VIIIB  <  Posterior Lobe  <  cerebellar hemispheres  < cerebellar cortex,Spinal cord excitatory neurons,Spinal cord excitatory neurons
B3GALTL,5.6953e-12,Not_Available,Not_Available,Not_Available,Not_Available,0.350691619202604,0.403335706295129,+,0.701,0.198315824,0.0191,0.755,189,1,Not_Available,Not_Available,lateral group of nuclei dorsal division,lateral group of nuclei dorsal division <  lateral group of nuclei  <  dorsal thalamus  <  thalamus  <  diencephalon  < gray matter,lateral group of nuclei dorsal division <  lateral group of nuclei  < dorsal thalamus,Not_Available,Not_Available
HLA-DQB1,2.3306e-07,"major histocompatibility complex, class II, DQ beta 1",-+,-+--,Not_Available,0.469885480092735,0.350867305703319,-,0.702,0.288173405,0.0191,0.755,189,1,0.989,"major histocompatibility complex, class II, DQ beta 1",supraoptic nucleus,supraoptic nucleus <  anterior hypothalamic region  <  hypothalamus  <  diencephalon  < gray matter,supraoptic nucleus < anterior hypothalamic region,Oligodendrocytes,Oligodendrocytes
HS6ST3,1.6614e-08,heparan sulfate 6-O-sulfotransferase 3,+-,+---,+-,0.398763732319769,0.351305014136469,-,0.703,0.284376217,0.0191,0.755,189,1,0.72,heparan sulfate 6-O-sulfotransferase 3,dorsal lateral geniculate nucleus,dorsal lateral geniculate nucleus <  dorsal lateral geneiculate nucleus  <  dorsal thalamus  <  thalamus  <  diencephalon  < gray matter,dorsal lateral geniculate nucleus <  dorsal lateral geneiculate nucleus  < dorsal thalamus,Spinal cord inhibitory neurons,Spinal cord inhibitory neurons
PCDHA4,3.5744e-07,protocadherin alpha 4,-+,-+--,Not_Available,0.453237979763625,0.359074676722779,-,0.718,0.232814527332305,0.0191,0.755,193,1,Not_Available,protocadherin alpha 4,midbrain raphe nuclei,midbrain raphe nuclei <  midbrain tegmentum  <  mesencephalon  < gray matter,midbrain raphe nuclei < midbrain tegmentum,Telencephalon inhibitory interneurons,Enteric neurons
BSN,1.6089e-06,bassoon presynaptic cytomatrix protein,+-,+--+,--,0.430427385891122,0.364225882209288,-,0.728,0.225051868,0.0191,0.755,196,1,0.646,bassoon presynaptic cytomatrix protein,CA3 field,CA3 field <  hippocampal formation  <  limbic lobe  <  cerebral cortex  <  telencephalon  < gray matter,CA3 field <  hippocampal formation  < limbic lobe,Telencephalon projecting excitatory neurons,Telencephalon projecting excitatory neurons
C11orf31,5.1084e-07,Not_Available,Not_Available,Not_Available,Not_Available,0.36558684378179,0.374169988303585,+,0.731,0.235085393,0.0191,0.755,197,1,Not_Available,Not_Available,superior temporal gyrus lateral bank of gyrus,superior temporal gyrus lateral bank of gyrus <  superior temporal gyrus  <  temporal lobe  <  cerebral cortex  <  telencephalon  < gray matter,superior temporal gyrus lateral bank of gyrus <  superior temporal gyrus  < temporal lobe,Telencephalon inhibitory interneurons,Sympathetic cholinergic neurons
ETFDH,1.4397e-06,electron transfer flavoprotein dehydrogenase,--,+++-,-+,0.424523405320847,0.367792473989416,-,0.736,0.193017828,0.0191,0.755,198,1,0.678,electron transfer flavoprotein dehydrogenase,globus pallidus internal segment,globus pallidus internal segment <  globus pallidus  <  basal ganglia  <  cerebral nuclei  <  telencephalon  < gray matter,globus pallidus internal segment <  globus pallidus  < basal ganglia,Choroid epithelial cells,Sympathetic cholinergic neurons
PSEN2,2.6771e-06,presenilin 2,++,--+-,--,0.410917364785255,0.370078884097959,-,0.74,0.220963483,0.0191,0.755,199,1,0.438,presenilin 2,dorsal lateral geniculate nucleus,dorsal lateral geniculate nucleus <  dorsal lateral geneiculate nucleus  <  dorsal thalamus  <  thalamus  <  diencephalon  < gray matter,dorsal lateral geniculate nucleus <  dorsal lateral geneiculate nucleus  < dorsal thalamus,Cholinergic and monoaminergic neurons,Sympathetic cholinergic neurons
TYR,6.9688e-09,tyrosinase,++,Not_Available,Filtered_Out,0.431154460415241,0.37751668282667,-,0.755,0.712210192807764,0.0191,0.755,203,1,0.504,tyrosinase,inferior temporal gyrus lateral bank of gyrus,inferior temporal gyrus lateral bank of gyrus <  inferior temporal gyrus  <  temporal lobe  <  cerebral cortex  <  telencephalon  < gray matter,inferior temporal gyrus lateral bank of gyrus <  inferior temporal gyrus  < temporal lobe,Spinal cord inhibitory neurons,Spinal cord inhibitory neurons
FADS2,1.9429e-08,fatty acid desaturase 2,--,++--,--,0.432483457074441,0.381014664697981,-,0.762,0.157199719,0.0191,0.755,205,1,0.768,fatty acid desaturase 2,central glial substance,central glial substance <  myelencephalon  < gray matter,central glial substance <  myelencephalon  < gray matter,Satellite glia,Satellite glia
PSORS1C1,1.7445e-08,psoriasis susceptibility 1 candidate 1,-+,Missing_P_Values,Filtered_Out,0.436776364569669,0.381873146246863,-,0.764,0.602083261903394,0.0191,0.755,205,1,0.0512,psoriasis susceptibility 1 candidate 1,temporal pole superior aspect,temporal pole superior aspect <  temporal pole  <  temporal lobe  <  cerebral cortex  <  telencephalon  < gray matter,temporal pole superior aspect <  temporal pole  < temporal lobe,Not_Available,Not_Available
